{
 "schemaVersion": 1,
 "source": "google_business_profile",
 "isExample": false,
 "provenance": "REAL reviews: snapshot pulled 2026-10-22 from the public endpoint used by the current Duda 'Google Reviews' app (googlereviews.api-files.com) for site dc6a3147. Data originates from Google Business Profile.",
 "generated": "2026-10-22T03:00:00Z",
 "place": {
  "name": "RankingCo",
  "placeId": "ChIJ0Uwx6tZbkWsRckAFlPHZQwQ",
  "gbpLocation": "accounts/107203499451749939998/locations/11761329554037562802",
  "address": "20 Bailey Street, West End QLD 4101",
  "reviewUrl": "https://search.google.com/local/writereview?placeid=ChIJ0Uwx6tZbkWsRckAFlPHZQwQ",
  "mapsUrl": "https://www.google.com/maps/place/?q=place_id:ChIJ0Uwx6tZbkWsRckAFlPHZQwQ"
 },
 "summary": {
  "averageRating": 4.96,
  "totalReviews": 140,
  "note": "Counts reflect reviews in this feed; Google profile total may differ slightly."
 },
 "reviews": [
  {
   "id": "AbFvOqnaYoQ2AwxFi0HJWVOSOV0rOdSIG7U2q0MRyDGVPbdhrOF8ZDkDybJJck5YNZZRGIngRFacxQ",
   "author": "Sunny Miezis",
   "photo": "https://lh3.googleusercontent.com/a-/ALV-UjXqVte27cbmZ9fNOWEAxtypEz7xAHtZ-twziA-1kFWupSBt_Js=s120-c-rp-mo-ba12-br100",
   "rating": 5,
   "text": "Jake Gilbert was amazing to work with on my business. As a mortgage broker, trying to increase my leads through Google ads is important to me and Jake's expertise was indispensable in helping me explore options and gain traction in the industry.\n\nCould not recommend highly enough - thanks Jake and the team there!",
   "created": "2026-10-13T23:37:21.882807Z",
   "updated": "2026-10-13T23:37:21.882807Z"
  },
  {
   "id": "AbFvOqnOkKHk9IfUIdANp7apCoLamHl5-sdicY_F1bQ6zc1Jr4qalHgI6V7vl3if4jbWJESp84Klvg",
   "author": "Chris Green",
   "photo": "https://lh3.googleusercontent.com/a/ACg8ocI8w8QqERHfA4jEb7mRFc8C2D6YCJ0PEEQNpbyzzafFRE7f7g=s120-c-rp-mo-br100",
   "rating": 5,
   "text": "CJG Tax, Assurance and Advisory Services\n\nRanking Co has been the number 1 best thing that has happened to my business. I was lucky enough to have been approached by a sales rep from ranking co when I was on the verge of shutting down my Google ads campaign due to how poorly google had set it up for me.\n\nTo say Ranking Co has been an absolutely amazing service is a complete understatement. Sam Fields is an absolute Wizard at Google Ads, and his work has resulted in a large number of fantastic leads. In addition to that, he is one of the nicest most patient people you could ask for. Their whole team has been a delight to deal with.\n\nMy my own admission, I have been a very difficult client for them due to a number of things, and the team have been patient with me and understanding when in reality, they had every right to terminate our relationship due to the difficulty I've presented for them.\n\nI am so unbelievably grateful for the team at Ranking Co, and have found a business partner for life. Thank you Sam and the team, I appreciate you endlessley.",
   "created": "2026-09-19T22:44:57.269213Z",
   "updated": "2026-09-19T22:44:57.269213Z"
  },
  {
   "id": "AbFvOqm9NjIfrm26EJAVll_Iz9prAfOexM69PlVVebZGZSvvrLn7X2ioKM7FYin2SRSMZ8hM1QQzTA",
   "author": "Georgia Lu",
   "photo": "https://lh3.googleusercontent.com/a-/ALV-UjXIoTYI3_Tn6n8O_aycsdt8wSR9eETjf4yFXOgNq7_oreQZ1GLW=s120-c-rp-mo-ba12-br100",
   "rating": 5,
   "text": "We’ve had a fantastic experience working with RankingCo. I was quite conservative and hesitant at the beginning because it was my first time using a company like this, but I’m so glad I gave them a chance.\n\nA special thank you to Hamza, who has been amazing throughout the process. He’s professional, responsive, responsible, and always takes the time to explain everything clearly. His communication has been excellent, and it’s obvious he genuinely cares about helping his clients achieve the best results.\n\nSince working with RankingCo, we’ve definitely seen benefits for our business, and I look forward to seeing what we can achieve together in the future.\n\nI highly recommend RankingCo to any business looking to improve their online presence. Thanks again, Hamza, for all your hard work and support!",
   "created": "2026-07-23T03:36:38.909996Z",
   "updated": "2026-07-23T03:36:38.909996Z"
  },
  {
   "id": "AbFvOqmcV7nHaastbUeQoDcsDi7jrsVH9iTK50zuGWh3ExMUAZNhBkAAUwJPdQLo7LKx0_nfY501rw",
   "author": "Paul Morgan",
   "photo": "https://lh3.googleusercontent.com/a/ACg8ocJgWmwp3G3KMCXEX8u6Y-QILq-6PDUXti3rs5QcihnkAUH10w=s120-c-rp-mo-br100",
   "rating": 5,
   "text": "Hamza has been fantastic to work with. His attention to detail and professionalism has made the whole process easy. He genuinely cares about achieving the best results. Highly recommended",
   "created": "2026-07-21T02:48:06.798952Z",
   "updated": "2026-07-21T02:48:06.798952Z"
  },
  {
   "id": "AbFvOql84AUb-rnVTFbNuwTFsWhuygxVFZreqKvY5okaDiLRw-6XZSknou92RW6-EE0F7sN6NhzMyA",
   "author": "Marine Energy Systems",
   "photo": "https://lh3.googleusercontent.com/a/ACg8ocLf-3sRehPGYxZypb80FIoPCzdGCk1dXhoILgHEXc3eLkEiky8=s120-c-rp-mo-br100",
   "rating": 5,
   "text": "Been using Sam from Ranking Co for over a year now and its made a huge difference on our business seeing an increase of nearly 70% on average in orders compared to last year cant recomend Sam enough",
   "created": "2026-06-23T22:17:49.352481Z",
   "updated": "2026-06-23T22:17:49.352481Z"
  },
  {
   "id": "AbFvOqlmveoBBjsiCJAaHT7NXh1n-Pyv7yeX6GNv48xLjCdT4j5QupdUt7uNkP_HgK-YIsmyyiJfrA",
   "author": "James Mak",
   "photo": "https://lh3.googleusercontent.com/a-/ALV-UjUUzV1_sUw9Plc_Hx8y6r_1yv-RfKTQc_RkgNTshhFqM4ArkJw3=s120-c-rp-mo-br100",
   "rating": 5,
   "text": "Super happy that i chose Ranking Co, at first i was hesitant as i thought they would be like every other Google Ads agency out there where they waste time and do the bare minimum, but ever since onboarding them they have helped increase sales as well as bring more exposure to my company. Would highly recommend them",
   "created": "2026-06-18T15:24:08.800042Z",
   "updated": "2026-06-18T15:24:08.800042Z"
  },
  {
   "id": "AbFvOqlktn8y7HRyj-4XZMPRe8zSfK1o1uG6n1L55wMJ8HPnLxmQ-30Y73pCqC4G9YxJPGNAe-oZzw",
   "author": "Doug Lindqvist",
   "photo": "https://lh3.googleusercontent.com/a/ACg8ocL3lUxktYtLAkUFH4XQg3Y2tPUofu-uqHxyO960l1Hw94cQFQ=s120-c-rp-mo-br100",
   "rating": 5,
   "text": "Sam and Amber are great to deal with. Professional and thorough.",
   "created": "2026-05-18T04:42:59.357924Z",
   "updated": "2026-05-18T04:42:59.357924Z"
  },
  {
   "id": "AbFvOqlhOwdkwUIX_Uh_EDe-m59bveIuA3RDxQlANLOD-wRr-T33HN3CZXhjC5j3td52U0YxPYRr",
   "author": "Peter Nicholson",
   "photo": "https://lh3.googleusercontent.com/a-/ALV-UjVZpyPC8qxvzgk5wKJyeqKO489IkPYFw0Od8WM-MKH8JY5x0ko=s120-c-rp-mo-ba12-br100",
   "rating": 5,
   "text": "Hi, Sally and RankingCo have been working with Nicholson Fine Foods for about 9 months now. During that time they have performed a number of tasks including the creation  and implementation of our digital marketing strategy and plan. We have seen good results over that time, especially in the lead up and post Christmas. This was identified as a priority in the strategy and plan. Sally is easy to work with and understands her service tools well. I recommend both Sally and RankingCo to anyone wanting to build on their online sales. Cheers Peter",
   "created": "2026-04-13T23:45:20.010321Z",
   "updated": "2026-04-13T23:45:20.010321Z"
  },
  {
   "id": "AbFvOqnt372Vv7IL-e7qhR0caEXAvGkbDdJsdiVxP7fjNQ8TXYWnh3AmLL80O3eMg6TnS-Y1MfRHFg",
   "author": "Benno Giuliani",
   "photo": "https://lh3.googleusercontent.com/a-/ALV-UjUdIGT4eI-OpEr_m_GI9LlUXvDYB1B72mbpx7qFr1FtvL53L208=s120-c-rp-mo-ba12-br100",
   "rating": 5,
   "text": "Great experience working with RankingCo. Professional team, clear communication, fast response times, and a genuine focus on results.",
   "created": "2026-03-12T01:27:45.958616Z",
   "updated": "2026-03-12T01:27:45.958616Z"
  },
  {
   "id": "AbFvOqn1xhlmlKFSqPiadr6yWbju1iZUvRqkk1LCX3Nj7UbZbzCdslpluFu6ILKYnlLjg2gluN3_Dg",
   "author": "Amisha Shah",
   "photo": "https://lh3.googleusercontent.com/a-/ALV-UjWJ5dwWbjzP-MRTbQe6mupZukGIqnS4ojxF4hdAyVqrnZMIWdnDBw=s120-c-rp-mo-ba12-br100",
   "rating": 5,
   "text": "I had a really positive experience with Amber. The initial consultation was inciteful and informative and it was focused to allow Amber to guage  exactly what my requirements were. She was prompt in sending me information for thought and was also open to hearing areas of concern and helping me navigate through it.\nWhether you choose to proceed with Rankingco or not, the level of service was excellent and very helpful. I highly recommend having that initial consultation with Amber.",
   "created": "2026-01-08T04:31:47.564070Z",
   "updated": "2026-01-08T04:31:47.564070Z"
  },
  {
   "id": "AbFvOqkBtXCndL_nFaTrz0ozQk031GMPOi2IcaKet2i39jKQGH9bL8Zn0oqaML399Du0mtfaERbNiA",
   "author": "Mim Kleiberg",
   "photo": "https://lh3.googleusercontent.com/a/ACg8ocJ1hJA9P5PQFoCNRQF3KYAZt_AYvp2jOZKiRQoEvz4f5Dik7g=s120-c-rp-mo-br100",
   "rating": 5,
   "text": "I've had the best experience with RankingCo. My account manager Hamza goes above and beyond to make sure ai get the best results. Amazing numbers on my Google Ads!",
   "created": "2025-12-19T19:41:28.528854Z",
   "updated": "2025-12-19T19:41:28.528854Z"
  },
  {
   "id": "AbFvOqlRClhDBNvtMXTVraZbQ8VSiRornIUCLQOyJ0_6VIEIkwc45eGBAHvEA1fB2kVhGhLkHC2D",
   "author": "Charles McArthur",
   "photo": "https://lh3.googleusercontent.com/a-/ALV-UjWSC480y1Szh4OFc3xfPLFEw38wlRBYosrvDHNmURVYdb6jUDJvFw=s120-c-rp-mo-ba12-br100",
   "rating": 5,